[{"id":"CN-T04-0001","subject_id":"cn","topic_id":"T04","topic_name":"Networking Devices","subtopic":"Section A — Physical-Layer Devices (Hub, Repeater, Modem & Simple Devices)","stem_en":"Which device operates only at the Physical layer (Layer 1) of the OSI model?","stem_hi":"OSI model की केवल Physical layer (Layer 1) पर कौन-सा device काम करता है?","options":[{"id":"A","text_en":"Switch","text_hi":"Switch"},{"id":"B","text_en":"Hub","text_hi":"Hub"},{"id":"C","text_en":"Router","text_hi":"Router"},{"id":"D","text_en":"Bridge","text_hi":"Bridge"}],"answer_option_id":"B","explanation_en":"A hub is a dumb Layer-1 device — it regenerates and forwards bits to ALL ports without reading MAC addresses.","explanation_hi":"Hub एक dumb Layer-1 device है — यह bits को regenerate करके सभी ports पर भेजता है, बिना MAC addresses पढ़े।","nukta_en":"Layer 1 = Hub, Repeater, Modem, cables. Layer 2 = Switch, Bridge, NIC. Layer 3 = Router. Gateway = all 7 (protocol converter).","nukta_hi":"Layer 1 = Hub, Repeater, Modem, cables। Layer 2 = Switch, Bridge, NIC। Layer 3 = Router। Gateway = सभी 7 (protocol converter)।","question_type":"single_select_mcq","question_style":"numerical","difficulty":"easy","difficulty_basis":"heuristic_classifier_estimate","source_type":"repository_internal","verification_status":"answer_checked","source_id":"src-447352eb0ffb","exam_name":null,"exam_year":null,"paper_or_shift":null,"exam_name_status":"none","exam_tags":["SSC Computer Awareness","RSMSSB Informatics Assistant","JNV TAT"],"exam_tag_basis":"suggested_practice_fit","official_evidence_id":null},{"id":"CN-T04-0002","subject_id":"cn","topic_id":"T04","topic_name":"Networking Devices","subtopic":"Section A — Physical-Layer Devices (Hub, Repeater, Modem & Simple Devices)","stem_en":"Which of the following devices operates only in the physical layer?","stem_hi":"निम्न में से कौन-सा device केवल physical layer पर काम करता है?","options":[{"id":"A","text_en":"Two-layer switch","text_hi":"Two-layer switch"},{"id":"B","text_en":"Router","text_hi":"Router"},{"id":"C","text_en":"Repeater","text_hi":"Repeater"},{"id":"D","text_en":"Bridge","text_hi":"Bridge"}],"answer_option_id":"C","explanation_en":"A repeater works at Layer 1 — it only regenerates (amplifies + reshapes) the signal to extend the cable distance.","explanation_hi":"Repeater Layer 1 पर काम करता है — यह केवल signal को regenerate (amplify + reshape) करके cable distance बढ़ाता है।","nukta_en":"Repeater = signal regenerator (L1). Hub = multi-port repeater (L1). Both are 'dumb' devices.","nukta_hi":"Repeater = signal regenerator (L1)। Hub = multi-port repeater (L1)। दोनों 'dumb' devices हैं।","question_type":"single_select_mcq","question_style":"concept","difficulty":"hard","difficulty_basis":"heuristic_classifier_estimate","source_type":"repository_internal","verification_status":"answer_checked","source_id":"src-fccba93a55fe","exam_name":"Kerala PSC","exam_year":null,"paper_or_shift":null,"exam_name_status":"source_label_unverified","exam_tags":["Kerala PSC"],"exam_tag_basis":"source_label_unverified","official_evidence_id":null},{"id":"CN-T04-0003","subject_id":"cn","topic_id":"T04","topic_name":"Networking Devices","subtopic":"Section A — Physical-Layer Devices (Hub, Repeater, Modem & Simple Devices)","stem_en":"Which of the following pairs lists the network devices used at the physical layer?","stem_hi":"निम्न में से कौन-सी जोड़ी physical layer पर उपयोग होने वाले network devices बताती है?","options":[{"id":"A","text_en":"Gateway, Bridge","text_hi":"Gateway, Bridge"},{"id":"B","text_en":"Router, Repeater","text_hi":"Router, Repeater"},{"id":"C","text_en":"Hub, Switch","text_hi":"Hub, Switch"},{"id":"D","text_en":"Repeater, Hub","text_hi":"Repeater, Hub"}],"answer_option_id":"D","explanation_en":"Repeater and Hub both work at the physical layer — they regenerate/forward signals without frame intelligence.","explanation_hi":"Repeater और Hub दोनों physical layer पर काम करते हैं — ये signals को regenerate/forward करते हैं, बिना frame intelligence के।","nukta_en":"Rajasthan PYQ (verified key: D). Physical-layer pair = Repeater + Hub. Switch/Bridge = L2, Gateway = L7.","nukta_hi":"Rajasthan PYQ (verified key: D)। Physical-layer जोड़ी = Repeater + Hub। Switch/Bridge = L2, Gateway = L7।","question_type":"single_select_mcq","question_style":"concept","difficulty":"medium","difficulty_basis":"heuristic_classifier_estimate","source_type":"repository_internal","verification_status":"answer_checked","source_id":"src-ff2ef6a2a91c","exam_name":null,"exam_year":null,"paper_or_shift":null,"exam_name_status":"none","exam_tags":["RSMSSB Informatics Assistant","SSC Computer Awareness","RPSC Programmer"],"exam_tag_basis":"suggested_practice_fit","official_evidence_id":null},{"id":"CN-T04-0004","subject_id":"cn","topic_id":"T04","topic_name":"Networking Devices","subtopic":"Section A — Physical-Layer Devices (Hub, Repeater, Modem & Simple Devices)","stem_en":"Which of the following are network connecting devices? 1. Repeater  2. Bridge  3. Hub  4. Bluetooth","stem_hi":"निम्न में से कौन network connecting devices हैं? 1. Repeater  2. Bridge  3. Hub  4. Bluetooth","options":[{"id":"A","text_en":"1, 2 and 3","text_hi":"1, 2 and 3"},{"id":"B","text_en":"1, 2 and 4","text_hi":"1, 2 and 4"},{"id":"C","text_en":"2, 3 and 4","text_hi":"2, 3 and 4"},{"id":"D","text_en":"1, 3 and 4","text_hi":"1, 3 and 4"}],"answer_option_id":"A","explanation_en":"Repeater, Bridge and Hub are all network connecting DEVICES; Bluetooth is a wireless TECHNOLOGY/standard, not a connecting device.","explanation_hi":"Repeater, Bridge और Hub — तीनों network connecting DEVICES हैं; Bluetooth एक wireless TECHNOLOGY/standard है, connecting device नहीं।","nukta_en":"Devices vs technologies: repeater/bridge/hub/switch/router = devices. Bluetooth/Wi-Fi/Ethernet = technologies/standards.","nukta_hi":"Devices बनाम technologies: repeater/bridge/hub/switch/router = devices। Bluetooth/Wi-Fi/Ethernet = technologies/standards।","question_type":"single_select_mcq","question_style":"concept","difficulty":"medium","difficulty_basis":"heuristic_classifier_estimate","source_type":"repository_internal","verification_status":"answer_checked","source_id":"src-312cc605110d","exam_name":null,"exam_year":null,"paper_or_shift":null,"exam_name_status":"none","exam_tags":["RSMSSB Informatics Assistant","SSC Computer Awareness","RPSC Programmer"],"exam_tag_basis":"suggested_practice_fit","official_evidence_id":null},{"id":"CN-T04-0005","subject_id":"cn","topic_id":"T04","topic_name":"Networking Devices","subtopic":"Section A — Physical-Layer Devices (Hub, Repeater, Modem & Simple Devices)","stem_en":"Which of the following statements are TRUE? 1. Switch reduces collision domain. 2. Hub creates a separate collision domain for each port. 3. Router separates broadcast domains.","stem_hi":"निम्न में से कौन-से कथन सही हैं? 1. Switch collision domain को कम करता है। 2. Hub हर port के लिए अलग collision domain बनाता है। 3. Router broadcast domains को अलग करता है।","options":[{"id":"A","text_en":"1 and 2 only","text_hi":"1 and 2 only"},{"id":"B","text_en":"2 and 3 only","text_hi":"2 and 3 only"},{"id":"C","text_en":"1 and 3 only","text_hi":"1 and 3 only"},{"id":"D","text_en":"1, 2 and 3","text_hi":"1, 2 and 3"}],"answer_option_id":"C","explanation_en":"Statement 1 is true (each switch port = own collision domain) and 3 is true (router = broadcast-domain boundary). Statement 2 is FALSE — a hub has ONE collision domain for all its ports.","explanation_hi":"कथन 1 सही है (हर switch port = अपना collision domain) और 3 सही है (router = broadcast-domain सीमा)। कथन 2 गलत है — hub के सभी ports के लिए एक ही collision domain होता है।","nukta_en":"Switch: collision ↓ (per-port). Hub: 1 collision domain. Router: broadcast domains separated. Ye teeno golden statements hain.","nukta_hi":"Switch: collision ↓ (per-port)। Hub: 1 collision domain। Router: broadcast domains अलग। ये तीनों golden statements हैं।","question_type":"single_select_mcq","question_style":"statement","difficulty":"medium","difficulty_basis":"heuristic_classifier_estimate","source_type":"repository_internal","verification_status":"answer_checked","source_id":"src-49defeb267f5","exam_name":null,"exam_year":null,"paper_or_shift":null,"exam_name_status":"none","exam_tags":["RSMSSB Informatics Assistant","SSC Computer Awareness","RPSC Programmer"],"exam_tag_basis":"suggested_practice_fit","official_evidence_id":null},{"id":"CN-T04-0006","subject_id":"cn","topic_id":"T04","topic_name":"Networking Devices","subtopic":"Section A — Physical-Layer Devices (Hub, Repeater, Modem & Simple Devices)","stem_en":"Which device combines transmission from various I/O devices into one line?","stem_hi":"कौन-सा device विभिन्न I/O devices के transmission को एक line में मिलाता है?","options":[{"id":"A","text_en":"Modifier","text_hi":"Modifier"},{"id":"B","text_en":"Multiplexer","text_hi":"Multiplexer"},{"id":"C","text_en":"Concentrator","text_hi":"Concentrator"},{"id":"D","text_en":"Gateway","text_hi":"Gateway"}],"answer_option_id":"B","explanation_en":"A multiplexer (MUX) combines several input signals into ONE shared line (FDM/TDM) at the sending end; a demultiplexer separates them again.","explanation_hi":"Multiplexer (MUX) भेजने वाली ओर कई input signals को एक shared line में मिलाता है (FDM/TDM); demultiplexer उन्हें फिर अलग करता है।","nukta_en":"MUX = many→one line (FDM/TDM/WDM). Concentrator = statistical sharing of a line. Gateway = protocol converter.","nukta_hi":"MUX = कई→एक line (FDM/TDM/WDM)। Concentrator = line का statistical sharing। Gateway = protocol converter।","question_type":"single_select_mcq","question_style":"concept","difficulty":"medium","difficulty_basis":"heuristic_classifier_estimate","source_type":"repository_internal","verification_status":"answer_checked","source_id":"src-f53544d110f0","exam_name":null,"exam_year":null,"paper_or_shift":null,"exam_name_status":"none","exam_tags":["RSMSSB Informatics Assistant","SSC Computer Awar